{"architecture":"amd64","identity":{"bootId":"boot-1","sandboxId":"sandbox-1","templateDigest":"sha256:aaaaaaaaaaaaaaaaaaaaaaaaaaaaaaaaaaaaaaaaaaaaaaaaaaaaaaaaaaaaaaaa","vmId":"vm-1"},"kind":"squire-sandbox-host-observer-request","parentRequestId":"44444444-4444-4444-8444-444444444444","paths":{"bridgePath":"/tmp/host-state/bridge","evidenceRoot":"/tmp/evidence","stateRoot":"/tmp/host-state"},"phase":"running","platform":"linux","probe":"network-audit","releaseId":"release-v039","requestId":"33333333-3333-4333-8333-333333333333","requestedAt":"2026-09-01T12:00:00.000Z","runId":"run_hostconformance01","sandboxName":"squire-v1-j4gbqa6djpmmsnwvlvqz5jw34e","schemaVersion":1}
